{
  "format": "ohc.glossary",
  "version": "0.1",
  "specVersion": "0.1.0-draft",
  "referenceLanguage": "en",
  "requiredLanguages": [
    "en",
    "ru"
  ],
  "languagePolicy": "English is the reference language for normative publication. The English definitions are binding for 0.1; the Russian definitions are a draft translation and establish no requirements of their own.",
  "groups": [
    {
      "id": "model",
      "en": "Data model",
      "ru": "Модель данных",
      "status": "draft",
      "description": {
        "en": "What a context is made of: the subject, the parties, records and their time axes.",
        "ru": "Из чего состоит контекст: субъект, участники, записи и их оси времени."
      }
    },
    {
      "id": "status",
      "en": "Status",
      "ru": "Статусы",
      "status": "draft",
      "description": {
        "en": "The separate status axes of a record and the label computed from them.",
        "ru": "Отдельные оси статуса записи и метка, вычисляемая из них."
      }
    },
    {
      "id": "disclosure",
      "en": "Disclosure",
      "ru": "Раскрытие",
      "status": "draft",
      "description": {
        "en": "How sensitive content is, why it may be used, and what may never be done with it.",
        "ru": "Насколько чувствительно содержание, зачем его можно использовать и что с ним нельзя делать никогда."
      }
    },
    {
      "id": "experience",
      "en": "Experience",
      "ru": "Опыт",
      "status": "draft",
      "description": {
        "en": "Primary sources, episodes, readings of them, conflicts, practices and the return of one's own experience.",
        "ru": "Первичные источники, эпизоды, их прочтения, конфликты, практики и возвращение собственного опыта."
      }
    },
    {
      "id": "lenses",
      "en": "Lenses",
      "ru": "Линзы",
      "status": "draft",
      "description": {
        "en": "Frameworks of description, the person's relation to them, and results within them.",
        "ru": "Системы описания, отношение человека к ним и результаты в их рамках."
      }
    },
    {
      "id": "governance",
      "en": "Governance",
      "ru": "Управление",
      "status": "draft",
      "description": {
        "en": "Permissions, status changes, the log and erasure.",
        "ru": "Разрешения, изменения статуса, журнал и удаление."
      }
    },
    {
      "id": "exchange",
      "en": "Exchange",
      "ru": "Обмен",
      "status": "draft",
      "description": {
        "en": "What leaves the holder and what comes back to it.",
        "ru": "Что выходит от держателя и что к нему возвращается."
      }
    }
  ],
  "sources": [
    {
      "title": "ISO 704 — Terminology work: principles and methods",
      "url": "https://www.iso.org/standard/79077.html"
    },
    {
      "title": "W3C SKOS — concepts and language labels",
      "url": "https://www.w3.org/TR/skos-reference/"
    },
    {
      "title": "W3C — language tags (BCP 47)",
      "url": "https://www.w3.org/International/articles/language-tags/"
    },
    {
      "title": "W3C PROV-O — provenance ontology",
      "url": "https://www.w3.org/TR/prov-o/"
    },
    {
      "title": "W3C Data Privacy Vocabulary (DPV)",
      "url": "https://w3id.org/dpv"
    }
  ],
  "terms": [
    {
      "id": "open-human-context",
      "group": "model",
      "status": "draft",
      "revision": 1,
      "locales": {
        "en": {
          "preferred": "Open Human Context (OHC)",
          "aliases": [
            "OHC"
          ],
          "definition": "An open, file-based format for a person's context, shared with agents by permission.",
          "example": "Ilse keeps her OHC context as one JSON file and gives a scheduling agent a grant to read three claims.",
          "status": "draft",
          "basedOnRevision": 1,
          "reviewedRevision": null
        },
        "ru": {
          "preferred": "Open Human Context (OHC)",
          "aliases": [
            "OHC"
          ],
          "definition": "Открытый файловый формат контекста человека, которым он делится с агентами по разрешению.",
          "example": "Ильзе хранит свой контекст OHC в одном файле JSON и даёт агенту-планировщику разрешение читать три утверждения.",
          "status": "draft",
          "basedOnRevision": 1,
          "reviewedRevision": null
        }
      },
      "seeAlso": [
        "context",
        "grant",
        "projection"
      ],
      "externalMappings": [],
      "reviewNote": ""
    },
    {
      "id": "tagline",
      "group": "model",
      "status": "draft",
      "revision": 1,
      "locales": {
        "en": {
          "preferred": "tagline",
          "aliases": [
            "five clauses"
          ],
          "definition": "A person changes. Their goals conflict. Their memory is selective. Their understanding of themselves is revised. Sometimes they lose access to their own ways of coping with what is happening.",
          "example": "The opening line of the README and the overview, and the five clauses of SPECIFICATION.md §2.1, reuse this wording verbatim.",
          "status": "draft",
          "basedOnRevision": 1,
          "reviewedRevision": null
        },
        "ru": {
          "preferred": "девиз",
          "aliases": [
            "пять утверждений"
          ],
          "definition": "Человек сам меняется. Его цели противоречивы. Его память избирательна. Его представления о себе пересматриваются. Иногда он теряет доступ к собственным способам справляться с происходящим.",
          "example": "Первая строка README и обзора и пять утверждений SPECIFICATION.md §2.1 повторяют эту формулировку дословно.",
          "status": "draft",
          "basedOnRevision": 1,
          "reviewedRevision": null
        }
      },
      "seeAlso": [
        "open-human-context"
      ],
      "docs": [
        "spec/SPECIFICATION.md §2.1",
        "README.md",
        "docs/OVERVIEW.md",
        "docs/OVERVIEW.ru.md"
      ],
      "externalMappings": [],
      "reviewNote": "The Russian text is the original and is reproduced verbatim. The English text is the single canonical provisional rendering until the owner confirms it; every English page reuses it unchanged, including its last clause."
    },
    {
      "id": "context",
      "group": "model",
      "status": "draft",
      "revision": 1,
      "locales": {
        "en": {
          "preferred": "context",
          "aliases": [],
          "definition": "The set of records about one person, with their origins and permissions.",
          "example": "Noa's context holds her goals, three accounts of one episode and two grants.",
          "status": "draft",
          "basedOnRevision": 1,
          "reviewedRevision": null
        },
        "ru": {
          "preferred": "контекст",
          "aliases": [],
          "definition": "Совокупность записей об одном человеке вместе с их происхождением и разрешениями.",
          "example": "Контекст Ноа содержит её цели, три рассказа об одном эпизоде и два разрешения.",
          "status": "draft",
          "basedOnRevision": 1,
          "reviewedRevision": null
        }
      },
      "modelKinds": [
        "Context"
      ],
      "seeAlso": [
        "subject",
        "record",
        "holder"
      ],
      "externalMappings": [],
      "reviewNote": ""
    },
    {
      "id": "subject",
      "group": "model",
      "status": "draft",
      "revision": 1,
      "locales": {
        "en": {
          "preferred": "subject",
          "aliases": [
            "the person"
          ],
          "definition": "The person a context is about.",
          "example": "In Kofi's context the subject is Kofi; agents refer to him only by a pairwise alias.",
          "status": "draft",
          "basedOnRevision": 1,
          "reviewedRevision": null
        },
        "ru": {
          "preferred": "субъект",
          "aliases": [
            "человек"
          ],
          "definition": "Человек, о котором контекст.",
          "example": "В контексте Кофи субъект — сам Кофи; агенты обращаются к нему только по парному псевдониму.",
          "status": "draft",
          "basedOnRevision": 1,
          "reviewedRevision": null
        }
      },
      "modelKinds": [
        "Subject"
      ],
      "seeAlso": [
        "context",
        "pairwise-alias"
      ],
      "externalMappings": [],
      "reviewNote": ""
    },
    {
      "id": "holder",
      "group": "model",
      "status": "draft",
      "revision": 1,
      "locales": {
        "en": {
          "preferred": "holder",
          "aliases": [],
          "definition": "Whoever keeps the context and serves projections.",
          "example": "Noa is her own holder; a personal agent could also act as holder under her policy.",
          "status": "draft",
          "basedOnRevision": 1,
          "reviewedRevision": null
        },
        "ru": {
          "preferred": "держатель",
          "aliases": [],
          "definition": "Тот, кто хранит контекст и выдаёт проекции.",
          "example": "Ноа сама держатель своего контекста; держателем по её правилам мог бы быть и личный агент.",
          "status": "draft",
          "basedOnRevision": 1,
          "reviewedRevision": null
        }
      },
      "seeAlso": [
        "projection",
        "grant"
      ],
      "externalMappings": [],
      "reviewNote": ""
    },
    {
      "id": "party",
      "group": "model",
      "status": "draft",
      "revision": 1,
      "locales": {
        "en": {
          "preferred": "party",
          "aliases": [],
          "definition": "Anyone other than the subject who asserts, narrates, receives or appears.",
          "example": "The supplier contact, the coach and the work assistant are parties in Noa's context, labelled by role.",
          "status": "draft",
          "basedOnRevision": 1,
          "reviewedRevision": null
        },
        "ru": {